{
  "question": "How much did we spend on marketing last month?",
  "answer_value": null,
  "answer_unit": "none",
  "period_label": null,
  "interpretation_text": "No reading of the data answers this question",
  "verdict": {
    "status": "Stable",
    "max_variance_pct": 0,
    "axis": null,
    "materiality_ok": false,
    "single_reading": true,
    "thresholds": { "stable": 5, "sensitive": 15 }
  },
  "alternatives": [],
  "breakdown": [],
  "evidence_ref": null,
  "anomalies": [],
  "allowed_numbers": [0],
  "clarification": null,
  "refusal": {
    "reason": "The dataset has no category column, and TBX does not invent one. Marketing spend cannot be derived from a bank narration without guessing.",
    "can_do": [
      "Spend for a period, in total or split by channel",
      "Spend or receipts for a named counterparty",
      "A ranking of counterparties by amount paid",
      "Balances per account or per entity",
      "A lookup by reference number or UTR",
      "Reconciliation checks: balance gaps, unmatched transfers, unreferenced rows"
    ]
  },
  "explanation": "There is no category column in this data, so marketing spend cannot be separated from any other payment. Ask for spend by channel or by counterparty instead and the answer will be exact.",
  "explanation_source": "template"
}
